id;description;eligibility;keywords;long_description;name;pre_requisites;fees;active;reference_url;created_by;created_date_time;modified_by;modified_date_time;migrated_by;version;how_to;service_record_id;application_id
1;Dynamic Home Loan Account;dot-com;methodology Integration Music;Pants;Avon;blue scalable Car;bypassing Sleek Steel Shirt Rand Namibia Dollar;F;Jewelery Engineer Bedfordshire;Tanzanian Shilling Assurance Nebraska;2019-06-22T22:00:44;stable override;2019-06-23T07:14:31;orchestrat;24240;Metal Auto Loan Account;3;1
2;Avon Applications;Montenegro;frictionless;Rubber Awesome Frozen Mouse;Trinidad and Tobago Dollar;Customer-focused;Shoes Rubber Mall;u;transmitting parse infrastructures;matrix Implementation Shirt;2019-06-23T10:08:06;synthesize Arizona synthesizing;2019-06-23T08:22:35;1080p indi;16426;open-source;7;7
3;National structure;whiteboard indexing;interface Central;intranet index;Idaho customized;synthesize Bahrain;Pre-emptive Bouvet Island (Bouvetoya) experiences;C;Belize Dollar Bacon;Investment Account Rwanda Customer;2019-06-22T16:48:17;Cheese orchestration Robust;2019-06-22T17:52:35;Electronic;56988;connect USB scalable;9;6
4;generate;Rubber syndicate;Cameroon Bedfordshire models;driver payment Mexican Peso Mexican Unidad de Inversion (UDI);port Money Market Account;Chips National Idaho;vortals value-added;S;Generic Advanced;HDD Security Virginia;2019-06-22T19:00:41;Lead alarm Cheese;2019-06-22T21:54:00;Checking A;73644;Configuration;10;10
5;Wooden Visionary;hacking;programming;FTP;Persistent Investment Account;Handmade Plastic Mouse neural;Money Market Account;s;JSON National;interactive capacitor;2019-06-23T00:52:40;Assimilated Unions;2019-06-23T08:21:01;Towels;49836;web-readiness;10;4
6;multi-byte modular;Electronics;Bedfordshire Strategist;Towels applications;Zimbabwe;Bedfordshire;application scale;i;Expressway;Tools Street;2019-06-22T22:10:29;Gorgeous Soft Fish Mountain;2019-06-22T23:08:44;supply-cha;55964;Computer Pants SDD;10;8
7;didactic Dynamic;schemas Industrial;calculating;withdrawal Toys white;olive;Kids Incredible;Florida THX Idaho;L;neural Markets Branding;maroon;2019-06-23T04:41:43;Senior;2019-06-23T11:25:08;Handmade f;2653;Salad;6;7
8;circuit Forward;frictionless solution-oriented;distributed Computers;Money Market Account users Guinea;SQL lavender;transmit Wooden COM;Agent Squares;s;Bedfordshire;Peru withdrawal Down-sized;2019-06-23T08:23:11;navigating Liaison;2019-06-22T23:06:52;Chicken ne;91429;Soft Missouri;3;1
9;reintermediate Buckinghamshire;yellow Games Concrete;system-worthy pixel Phased;withdrawal Towels;navigating seize generate;Fantastic Wooden Chips microchip;Generic;B;International card;West Virginia Keys;2019-06-22T19:48:10;Research sensor black;2019-06-23T10:58:57;clear-thin;5142;Cambridgeshire Savings Account extensible;8;5
10;robust;interface Buckinghamshire;Investment Account Forge Licensed;auxiliary;Engineer Toys Fantastic;Licensed;Marketing mobile Cayman Islands Dollar;C;input invoice calculate;Philippine Peso parsing Triple-buffered;2019-06-22T23:59:05;magenta Associate;2019-06-22T13:04:25;Small Meta;56794;Product Music;7;8
