id;description;eligibility;keywords;long_description;name;pre_requisites;fees;active;reference_url;created_by;created_date_time;modified_by;modified_date_time;migrated_by;version;how_to;service_record_id;application_id
1;Connecticut Burg;transmit Credit Card Account;digital Corporate Checking Account;seamless New York mesh;Unbranded array;Berkshire solid state;middleware Switzerland;D;compress Practical Steel Chips;Berkshire concept;2019-06-22T19:32:53;Future-proofed Awesome;2019-06-23T07:39:24;Rubber Shi;13882;deposit Chicken best-of-breed;9;9
2;Buckinghamshire Officer;teal Licensed Wooden Pants;e-business;Awesome;Kiribati;cyan innovative;open architecture alliance;o;Bulgarian Lev Cambridgeshire;Regional;2019-06-23T09:17:02;systemic;2019-06-22T15:24:04;quantify;18452;sky blue cultivate Bedfordshire;7;8
3;Kiribati monitor;Games;Metal;Internal Buckinghamshire Antarctica (the territory South of 60 deg S);ADP;Hungary Configurable;interface;T;overriding;internet solution;2019-06-23T07:52:31;National;2019-06-22T20:30:13;Indian Rup;49844;Awesome Russian Federation;6;6
4;Michigan Connecticut empower;customized payment;Grass-roots Cambridgeshire;Personal Loan Account;Music;Pants;Avon;b;bypassing Sleek Steel Shirt Rand Namibia Dollar;Fresh incubate Agent;2019-06-22T13:58:40;parsing;2019-06-23T04:33:36;Fish Tanza;92937;Nebraska Mississippi stable;8;3
5;Director;channels Buckinghamshire Open-source;pixel;asymmetric Montana Sausages;internet solution Checking Account;bleeding-edge Rubber;Yemen;o;Gorgeous Metal Shoes;Investment Account;2019-06-22T23:25:55;users scalable;2019-06-22T12:26:28;calculatin;73086;Implementation Shirt Unbranded Soft Fish;6;1
6;back-end synthesizing override;Bacon Mouse open-source;payment National;HDD;Tanzanian Shilling Lights;e-enable Plaza intranet;convergence Idaho customized;s;Pre-emptive Bouvet Island (Bouvetoya) experiences;Credit Card Account;2019-06-23T02:42:43;Wooden optical Investment Account;2019-06-22T21:56:48;Customer m;31172;Robust hack Electronics;6;8
7;Cambridgeshire navigate Licensed;Fantastic indexing;Investment Account;haptic Shoes;models;driver payment Mexican Peso Mexican Unidad de Inversion (UDI);port Money Market Account;C;vortals value-added;Salad Connecticut;2019-06-22T22:36:30;Money Market Account;2019-06-23T10:18:54;HDD Securi;69665;Lead alarm Cheese;6;4
8;Practical Steel Fish Unbranded;Chief Coves Concrete;Pizza yellow programming;FTP;Persistent Investment Account;Handmade Plastic Mouse neural;Money Market Account;s;JSON National;interactive capacitor;2019-06-22T23:53:48;Assimilated Unions;2019-06-23T07:22:09;Towels;49836;web-readiness;10;4
9;multi-byte modular;Electronics;Bedfordshire Strategist;Towels applications;Zimbabwe;Bedfordshire;application scale;i;Expressway;Tools Street;2019-06-22T21:11:37;Gorgeous Soft Fish Mountain;2019-06-22T22:09:52;supply-cha;55964;Computer Pants SDD;10;8
10;didactic Dynamic;schemas Industrial;calculating;withdrawal Toys white;olive;Kids Incredible;Florida THX Idaho;L;neural Markets Branding;maroon;2019-06-23T03:42:51;Senior;2019-06-23T10:26:15;Handmade f;2653;Salad;6;7
