id;created_by;created_date_time;modified_by;modified_date_time;version;additional_information;address_line_1;address_line_2;address_type;country_code;locality_name;location_point;postcode;state_code
1;Gloves Auto Loan Account customized;2019-06-22T13:13:03;Chips;2019-06-22T22:34:51;14071;green Pants;alarm hacking help-desk;Personal Loan Account Refined RAM;firewall toolset Administrator;KP;Metal alarm challenge;JBOD systems Keyboard;Kwac;Ant
2;programming blue innovate;2019-06-22T11:23:13;cutting-edge;2019-06-23T03:38:03;81906;Botswana application website;Internal withdrawal;end-to-end;transmitting FTP;LR;Realigned;bypassing;prog;Fre
3;ivory Credit Card Account;2019-06-23T00:17:52;Louisiana bus;2019-06-22T15:24:05;47128;Engineer deposit Soft;Incredible open architecture Movies;Mouse SMTP Vision-oriented;Gorgeous Steel Tuna cross-media XML;CW;sticky;Shoes;syst;Int
4;Handcrafted Fresh Ball invoice SMTP;2019-06-23T10:44:43;Computer deploy;2019-06-23T01:38:31;46035;AI;Cotton web services;Sleek synergies Practical Soft Chair;Specialist Fresh card;WF;synthesizing Trinidad and Tobago Dollar backing up;Communications hard drive migration;Falk;Bah
5;Ergonomic Concrete Bike Small Rubber Shoes;2019-06-23T03:56:17;generating;2019-06-23T08:58:05;29723;parallelism;Checking Account Unbranded Fresh Pizza SMTP;Money Market Account;Officer Checking Account Dominica;ST;4th generation interfaces zero tolerance;COM Norfolk Island Gorgeous Fresh Bike;Avon;Lea
6;Refined Frozen Towels Beauty North Korean Won;2019-06-23T08:46:37;District;2019-06-22T23:36:13;77387;Money Market Account;Table Soap Web;South Carolina Pakistan Rupee;Malagasy Ariary;BS;Innovative;Cambridgeshire withdrawal Response;Shoa;wit
7;Future;2019-06-23T10:40:47;Sleek Rubber Car Corporate;2019-06-23T05:01:02;27681;Architect info-mediaries;Savings Account Plain;holistic plum;Albania TCP;AU;backing up;Gorgeous web-enabled redundant;tan ;Res
8;bypassing mobile;2019-06-22T15:06:47;Guadeloupe;2019-06-22T13:38:00;50741;TCP Buckinghamshire;Tasty Cotton Keyboard Response Shirt;mindshare metrics;Swedish Krona Phased Guyana Dollar;FO;capacitor Creative driver;deposit Handmade Concrete Bacon Small Rubber Pizza;Cros;rev
9;Saint Kitts and Nevis Senior;2019-06-23T01:02:53;forecast;2019-06-22T16:45:13;94172;Zloty Zloty;HDD Checking Account;deposit Direct;Pizza Fish;MZ;reboot;Refined Granite Chips Fresh;Como;heu
10;integrate Direct;2019-06-22T15:21:27;pink Row;2019-06-22T15:08:55;65229;navigating;navigating whiteboard Gorgeous;standardization multi-byte;Secured revolutionize;JM;Virginia index Incredible;Alabama seize Checking Account;visu;sys
